{"$schema":"https://json-schema.org/draft/2020-12/schema","title":"Pasol Pattern Pack Signature 1.0.0","type":"object","additionalProperties":false,"required":["schema_version","algorithm","key_id","manifest_sha256","signature_hex"],"properties":{"schema_version":{"const":"1.0.0"},"algorithm":{"const":"ed25519"},"key_id":{"type":"string","minLength":1,"maxLength":256},"manifest_sha256":{"type":"string","pattern":"^[0-9a-f]{64}$"},"signature_hex":{"type":"string","pattern":"^[0-9a-f]{128}$"}}}
