{
  "schema_version": "1.0.0",
  "algorithm": "ed25519",
  "key_id": "test-key",
  "manifest_sha256": "c9bc6eab953687d5600d68c132de910ee7e29032d071c9eaa8a60498b86d3429",
  "signature_hex": "221addab7c0b41ad4def607a13c964e656fcd93776be6d0681814dbfa0ec60d0f48d7c77781b9180f6e0f289a3564a65dce590e9848210f469dc6a1aec19cb02"
}
